{
  "schema_version": 1,
  "order_id": "c1a9e2d4-3f55-4b0a-8e17-9b6d2f4a7c30",
  "status": "executed",
  "tx_hash": "0x4963a3d8e22c9d4a71c013f61aed299aa19ace9a0d8abf79f7aeca220e4d3fe7",
  "chain_id": 84532,
  "block_number": 12345678,
  "gas_used": 152000,
  "error_code": null,
  "detail": null,
  "executed_at": "2026-10-16T09:07:40Z"
}
